{
  "$schema": "https://json-schema.org/draft/2020-12/schema",
  "title": "CodeSite ProofBundle",
  "type": "object",
  "required": [
    "schemaVersion",
    "projectId",
    "transactionId",
    "mutationLeaseId",
    "readSetDigest",
    "writeSetDigest",
    "invariants",
    "evidenceRefs",
    "portableDigest",
    "proofSignature"
  ],
  "properties": {
    "schemaVersion": {
      "type": "string"
    },
    "projectId": {
      "type": "string"
    },
    "workspaceSlug": {
      "type": [
        "string",
        "null"
      ]
    },
    "transactionId": {
      "type": "string"
    },
    "mutationLeaseId": {
      "type": "string"
    },
    "displayCallsign": {
      "type": [
        "string",
        "null"
      ]
    },
    "landingStatus": {
      "type": [
        "string",
        "null"
      ]
    },
    "readSetDigest": {
      "type": "string"
    },
    "writeSetDigest": {
      "type": "string"
    },
    "invariants": {
      "type": "array"
    },
    "evidenceRefs": {
      "type": "array"
    },
    "dojoEvidenceRefs": {
      "type": "array"
    },
    "repoState": {
      "type": [
        "object",
        "null"
      ]
    },
    "incidentReplayDigest": {
      "type": [
        "string",
        "null"
      ]
    },
    "bundleDigest": {
      "type": [
        "string",
        "null"
      ]
    },
    "incidents": {
      "type": "array"
    },
    "lineProvenance": {
      "type": "array"
    },
    "createdAt": {
      "type": "string"
    },
    "portableDigest": {
      "type": "string"
    },
    "proofSignature": {
      "type": "object"
    }
  },
  "additionalProperties": true
}
