{
  "schemaVersion": "synthi.codesite.proofBundle.v1",
  "projectId": "cmr5n8kw400w5pm0zr1b3t9xu",
  "workspaceSlug": "codesite-mature-full-proof-20260703-overlay13",
  "transactionId": "cmr5n8ta300yspm0zf8blsf5p",
  "mutationLeaseId": "cmr5n8q0i00xspm0zc16y3e69",
  "displayCallsign": "SCHEMA-01",
  "landingStatus": "completed",
  "readSetDigest": "sha256:478271e6e2cb5a755bbfe83737ef10debab09482410cda922c58fc66fa20c83a",
  "writeSetDigest": "sha256:c9dc8f2e81e79067b5051b7a7e1beca884399b3b891086ab43fb576b0f74f973",
  "invariants": [
    "clearance.diff.inside_route"
  ],
  "evidenceRefs": [
    "mcp:audit:commit-full-workflow",
    "git:commit:46846bdbfb56f703c696de864d8cc76b0e3045b1",
    "codesite:runtime-attestation:sha256:1ec3047a71768b248d923647870f724c7e5eaa571421728db606ab7dd51c5e9e",
    "codesite:runtime-attestation:sha256:82976b2e280ea89841a9a0e20008a4971c03b2f95756dabd2d401c923930f550",
    "codesite:landing:passed-health-proof",
    "codesite:inspection:cmr5n97nm011ypm0zril7q8l1",
    "runtime:event:inspection-full-workflow",
    "typecheck:run:sha256:32f4a6805f75a2dbd59c12068983f8d4f082cb9b73d631922ec786848651126b",
    "artifact:sha256:32f4a6805f75a2dbd59c12068983f8d4f082cb9b73d631922ec786848651126b",
    "test:run:sha256:0798744e885d01fd0c4a0cc3b6beb0816a828b6f9c17d5b2b2acb888d3d0ffc4",
    "artifact:sha256:0798744e885d01fd0c4a0cc3b6beb0816a828b6f9c17d5b2b2acb888d3d0ffc4",
    "codesite:inspection:cmr5n96io011qpm0z8rwbzfgq",
    "codesite:repo-state:sha256:c663063aead7feb49e603a0bff0fd798b2ecfd8bd9dfa2d28258500d3aef7210",
    "codesite:transaction:cmr5n8ta300yspm0zf8blsf5p",
    "codesite:lease:cmr5n8q0i00xspm0zc16y3e69"
  ],
  "dojoEvidenceRefs": [],
  "repoState": {
    "schemaVersion": "synthi.codesite.repoStateEvidence.v1",
    "workspaceSlug": "codesite-mature-full-proof-20260703-overlay13",
    "transactionId": "cmr5n8ta300yspm0zf8blsf5p",
    "baseSnapshot": "sha256:3560190edab25c99eb49e054191bd19ab1096422c36a4f56c2faa39bf054d63c",
    "gitHead": "46846bdbfb56f703c696de864d8cc76b0e3045b1",
    "stagedDiffDigest": "sha256:e3b0c44298fc1c149afbf4c8996fb92427ae41e4649b934ca495991b7852b855",
    "worktreeDiffDigest": "sha256:e3b0c44298fc1c149afbf4c8996fb92427ae41e4649b934ca495991b7852b855",
    "writeFileDigests": [
      {
        "path": "synthi/prisma/schema.prisma",
        "digest": "sha256:cc965a1302ccd4ef3195e0250c972005cf2e4fe75bf52a69f3462917cef9a160",
        "size": 238,
        "exists": true
      }
    ],
    "generatedAt": "2026-07-04T00:48:43.006Z",
    "source": "collab-server",
    "evidenceDigest": "sha256:c663063aead7feb49e603a0bff0fd798b2ecfd8bd9dfa2d28258500d3aef7210"
  },
  "incidentReplayDigest": "sha256:c089bae2d03c678a1f8527c390a6ade0bbaf0321a0192cecdc6b8e5fc937eee5",
  "bundleDigest": "sha256:e8a39d32b9f957eadf40af85c2e3551fece7cddcfcf7e1c162edeba916cc37c3",
  "incidents": [
    {
      "id": "cmr5n8rel00y8pm0zmd8ctqbl",
      "severity": "warning",
      "category": "black_box",
      "replayDigest": "sha256:e0588bd464652fa6bb1c49e16f7d049c489ee62993c6cb2299ee9d3da159071e"
    },
    {
      "id": "cmr5n8svk00yopm0zbo898qk9",
      "severity": "warning",
      "category": "black_box",
      "replayDigest": "sha256:13b8b74db1aa95d2623560a7f358ea64bebb42c6208d1fb999fe589f8ff1721c"
    },
    {
      "id": "cmr5n9d7z013gpm0zum7t1rtt",
      "severity": "critical",
      "category": "security",
      "replayDigest": "sha256:070c797d2848ba0bf260614c43d7d8a080a6f6a56312c2f3604c5260ce885472"
    },
    {
      "id": "cmr5n94tn011mpm0zeee25jks",
      "severity": "low",
      "category": "black_box",
      "replayDigest": "sha256:c089bae2d03c678a1f8527c390a6ade0bbaf0321a0192cecdc6b8e5fc937eee5"
    }
  ],
  "lineProvenance": [
    {
      "filePath": "synthi/prisma/schema.prisma",
      "lineAnchor": "synthi/prisma/schema.prisma#L10-L15",
      "startLine": 10,
      "endLine": 15,
      "displayCallsign": "SCHEMA-01",
      "reasonRef": "change_order:cmr5n8zlg010qpm0zqjb5it52",
      "evidenceRefs": [
        "proof:cmr5nfxsx013mpm0z8sams7cu",
        "transaction:cmr5n8ta300yspm0zf8blsf5p",
        "event:cmr5n9490011gpm0zcpq30v2a",
        "mcp:audit:write-full-workflow",
        "codesite:document:cmr5n8zlg010qpm0zqjb5it52",
        "codesite:counterfactual-run:cmr5n8wlm00zwpm0zqoixdsl4",
        "hunk:sha256:808ec73ec6c5c02ba93b1e5dc380a534bc1ee00435ddc7a3769c7da1d13b3eb4",
        "codesite:document:cmr5n8yh0010ipm0z88mpt3oc",
        "codesite:inbox:cmr5n8yhb010mpm0zunqhpi1c",
        "codesite:inbox:cmr5n8zlp010upm0zvyihneg2",
        "codesite:assumption:cmr5n8tqn00yypm0z9kzgl2dr",
        "codesite:assumption:cmr5n8vfj00zepm0zt3l2a3la"
      ],
      "dojoSourceRefs": [
        "dojo:proof:pcap-full-workflow-schema",
        "dojo:decision:sha256:65e0f2715f0f2517b144752743e60200ef95559f38745d79b891183a91b8aba2",
        "full-workflow-checkride"
      ],
      "proofBundleId": "cmr5nfxsx013mpm0z8sams7cu",
      "processAncestry": [
        "mcp:synthi_codesite_apply_patch",
        "codex:tmp-proof-session"
      ],
      "promptSummary": "Land schema-first full workflow proof"
    }
  ],
  "createdAt": "2026-07-04T00:53:58.881Z",
  "portableDigest": "sha256:47239b17db4c8d30f923704b2c3f620ab1a9824e3f7dc145684aef2cca654bde",
  "proofSignature": {
    "schemaVersion": "synthi.codesite.proofSignature.v1",
    "algorithm": "ed25519",
    "keyId": "codesite-proof-ed25519-20260702",
    "authority": "CodeSite Mature Proof Authority",
    "signedAt": "2026-07-04T00:54:01.380Z",
    "payloadDigest": "sha256:47239b17db4c8d30f923704b2c3f620ab1a9824e3f7dc145684aef2cca654bde",
    "signature": "ed25519:codesite-proof-ed25519-20260702:weYZ7jXItnIIFie-xi0-0ACemnSsCQkJkFMuVwiAn5ZW682XS8QId099xy6R7zMcSWjdI48svnYhSK5HTsVmBw",
    "publicKeyPem": "-----BEGIN PUBLIC KEY-----\nMCowBQYDK2VwAyEAyCmSzFdxRGaQvSvXXg1jm4PzivnJ9BByBdMBzP5GMnQ=\n-----END PUBLIC KEY-----"
  }
}
