{
  "schemaVersion": "synthi.codesite.proofBundle.v1",
  "projectId": "cmr5lhrju000dpm0z9sb64ur7",
  "workspaceSlug": "codesite-mature-full-proof-20260703-overlay8",
  "transactionId": "cmr5li1840030pm0ziuph9b1r",
  "mutationLeaseId": "cmr5lhw270020pm0zv2swrhf0",
  "displayCallsign": "SCHEMA-01",
  "landingStatus": "completed",
  "readSetDigest": "sha256:478271e6e2cb5a755bbfe83737ef10debab09482410cda922c58fc66fa20c83a",
  "writeSetDigest": "sha256:c9dc8f2e81e79067b5051b7a7e1beca884399b3b891086ab43fb576b0f74f973",
  "invariants": [
    "clearance.diff.inside_route"
  ],
  "evidenceRefs": [
    "mcp:audit:commit-full-workflow",
    "git:commit:508c209b6d7184a1765809c1d1f6de8b6f75c9d1",
    "codesite:runtime-attestation:sha256:15daad00ea7264ac84e299a3e334b2630f6b2dbf81c88c1a2b1101b10ab88555",
    "codesite:runtime-attestation:sha256:cd594c44e0b2684807b2661d68eb073c3fb81f9c8f5f68202ac19f1e15928af9",
    "codesite:landing:passed-health-proof",
    "codesite:inspection:cmr5lihai0066pm0ztoa66xwm",
    "runtime:event:inspection-full-workflow",
    "typecheck:run:sha256:fc3adde5b81875296da0dc7590fab96305b27353eac623ea1bc6da4987107691",
    "artifact:sha256:fc3adde5b81875296da0dc7590fab96305b27353eac623ea1bc6da4987107691",
    "test:run:sha256:e660669e0332aabe4c0034930d49ca6ce502f0ece76caf6ee74124fee61ecb5b",
    "artifact:sha256:e660669e0332aabe4c0034930d49ca6ce502f0ece76caf6ee74124fee61ecb5b",
    "codesite:inspection:cmr5liged005ypm0zxs56b0z7",
    "codesite:repo-state:sha256:2d17f6bc39b03f4637563861493360eb1e1573aaefbf75868b59344e073b10bb",
    "codesite:transaction:cmr5li1840030pm0ziuph9b1r",
    "codesite:lease:cmr5lhw270020pm0zv2swrhf0"
  ],
  "dojoEvidenceRefs": [],
  "repoState": {
    "schemaVersion": "synthi.codesite.repoStateEvidence.v1",
    "workspaceSlug": "codesite-mature-full-proof-20260703-overlay8",
    "transactionId": "cmr5li1840030pm0ziuph9b1r",
    "baseSnapshot": "sha256:3560190edab25c99eb49e054191bd19ab1096422c36a4f56c2faa39bf054d63c",
    "gitHead": "508c209b6d7184a1765809c1d1f6de8b6f75c9d1",
    "stagedDiffDigest": "sha256:e3b0c44298fc1c149afbf4c8996fb92427ae41e4649b934ca495991b7852b855",
    "worktreeDiffDigest": "sha256:e3b0c44298fc1c149afbf4c8996fb92427ae41e4649b934ca495991b7852b855",
    "writeFileDigests": [
      {
        "path": "synthi/prisma/schema.prisma",
        "digest": "sha256:cc965a1302ccd4ef3195e0250c972005cf2e4fe75bf52a69f3462917cef9a160",
        "size": 238,
        "exists": true
      }
    ],
    "generatedAt": "2026-07-03T23:59:56.445Z",
    "source": "collab-server",
    "evidenceDigest": "sha256:2d17f6bc39b03f4637563861493360eb1e1573aaefbf75868b59344e073b10bb"
  },
  "incidentReplayDigest": "sha256:a90b886de17a4d4db33dffa1ddec0313b201ee61b178a18c8f7e82f3cf080e0c",
  "bundleDigest": "sha256:6adecd0878cc95a40b7734c4a23e8f87851fd0d2a4af81790f7488f4672950ab",
  "incidents": [
    {
      "id": "cmr5lhxg0002gpm0zp2wj3fei",
      "severity": "warning",
      "category": "black_box",
      "replayDigest": "sha256:4fabc44f206e6d1faaad4a015db9dc9bdd8def9062baa608bb49eea1d0213835"
    },
    {
      "id": "cmr5li0ns002wpm0zmfhjhvkd",
      "severity": "warning",
      "category": "black_box",
      "replayDigest": "sha256:d1e4d1e2a561f5fa7bd52dae28f44a6a49c24498dbe7339533bfbc409c73712e"
    },
    {
      "id": "cmr5limq6007opm0zuylre7k6",
      "severity": "critical",
      "category": "security",
      "replayDigest": "sha256:426f91e75a89977d184e82ccdf37d12abf585028615d6ca774a941ceb47c9544"
    },
    {
      "id": "cmr5liep0005upm0zgugnchf4",
      "severity": "low",
      "category": "black_box",
      "replayDigest": "sha256:a90b886de17a4d4db33dffa1ddec0313b201ee61b178a18c8f7e82f3cf080e0c"
    }
  ],
  "lineProvenance": [
    {
      "filePath": "synthi/prisma/schema.prisma",
      "lineAnchor": "synthi/prisma/schema.prisma#L10-L15",
      "startLine": 10,
      "endLine": 15,
      "displayCallsign": "SCHEMA-01",
      "reasonRef": "change_order:cmr5li92x004ypm0zeqwg9hzp",
      "evidenceRefs": [
        "proof:cmr5lmibx007upm0zz2xsky0g",
        "transaction:cmr5li1840030pm0ziuph9b1r",
        "event:cmr5lidxr005opm0zzlpvbpbf",
        "mcp:audit:write-full-workflow",
        "codesite:document:cmr5li92x004ypm0zeqwg9hzp",
        "codesite:counterfactual-run:cmr5li4po0044pm0z7po9wzj0",
        "hunk:sha256:808ec73ec6c5c02ba93b1e5dc380a534bc1ee00435ddc7a3769c7da1d13b3eb4",
        "codesite:document:cmr5li7ha004qpm0z6piq4wqm",
        "codesite:inbox:cmr5li7hu004upm0zsajvsef8",
        "codesite:inbox:cmr5li93g0052pm0z56f6c378",
        "codesite:assumption:cmr5li1w60036pm0zwbdn7kax",
        "codesite:assumption:cmr5li3ao003mpm0zbkt0rzak"
      ],
      "dojoSourceRefs": [
        "dojo:proof:pcap-full-workflow-schema",
        "dojo:decision:sha256:65e0f2715f0f2517b144752743e60200ef95559f38745d79b891183a91b8aba2",
        "full-workflow-checkride"
      ],
      "proofBundleId": "cmr5lmibx007upm0zz2xsky0g",
      "processAncestry": [
        "mcp:synthi_codesite_apply_patch",
        "codex:tmp-proof-session"
      ],
      "promptSummary": "Land schema-first full workflow proof"
    }
  ],
  "createdAt": "2026-07-04T00:03:06.189Z",
  "portableDigest": "sha256:b34bf0dcb5bea5cfb2fe8d3beaf64e373a6ab2d9dbefebcc48fb0040c50158c3",
  "proofSignature": {
    "schemaVersion": "synthi.codesite.proofSignature.v1",
    "algorithm": "ed25519",
    "keyId": "codesite-proof-ed25519-20260702",
    "authority": "CodeSite Mature Proof Authority",
    "signedAt": "2026-07-04T00:03:08.705Z",
    "payloadDigest": "sha256:b34bf0dcb5bea5cfb2fe8d3beaf64e373a6ab2d9dbefebcc48fb0040c50158c3",
    "signature": "ed25519:codesite-proof-ed25519-20260702:0cY8g4wPRsB0aasMUQH2m-LNjT0uETmDd6ScysDMzay5XKioy2DVaLXQqPLD5WwKiYD_CzPCIy2RxHhFyq28Cg",
    "publicKeyPem": "-----BEGIN PUBLIC KEY-----\nMCowBQYDK2VwAyEAyCmSzFdxRGaQvSvXXg1jm4PzivnJ9BByBdMBzP5GMnQ=\n-----END PUBLIC KEY-----"
  }
}
